id	link	date	text	category	sentiment
1459289040797240000	https://twitter.com/twitter/statuses/1459289040797245449	Fri Nov 12 22:36:34 +0000 2021	@IamExpatNL @markrutte @hugodejonge : I don’t understand why you thought it was time to lift restrictions.#covid certificates should always be imposed, masks should always stay &amp; capacity levels must stay.because people are not following social distancing, households gathering hasnt stopped	mandates	positive
1459289024753970000	https://twitter.com/twitter/statuses/1459289024753979392	Fri Nov 12 22:36:30 +0000 2021	@NaheedD Are you referring to vaccines or these ineffective, unlicensed COVID-19 trial injections?\n\nNot that I'm expecting an answer, nor should health workers you're dumping on.	efficacy	negative
1459288916486460000	https://twitter.com/twitter/statuses/1459288916486467592	Fri Nov 12 22:36:04 +0000 2021	@thebeavertales @Chrispbrinks @ChickenGate However. Even before COVID we made children prove their vaccine status to attend school. How is this different?	children	negative
1459288910924700000	https://twitter.com/twitter/statuses/1459288910924705793	Fri Nov 12 22:36:03 +0000 2021	@cspotweet Most people in the UCP and NDP support Nazi vaccine passports.\n\nTommy Douglas went to a Nazi rally in 1936 for the same reasons.\n\nMaybe the actual evil of the National Socialists should be studied and rejected.	mandates	negative
1459288896408140000	https://twitter.com/twitter/statuses/1459288896408145925	Fri Nov 12 22:35:59 +0000 2021	Last two days were awful that 2nd covid shot fucked me up slowly recovering feel much better now though after sleeping a whole 19 flipping hours XD	side_effect	neutral
1459288737255510000	https://twitter.com/twitter/statuses/1459288737255510016	Fri Nov 12 22:35:21 +0000 2021	@CPHO_Canada can you tell me where to find the data about children w HX of myocarditis and the covid vaccine? My 7 yo had twice at age 3. Do I give him vaccine (I believe he would be an approved med. Exemp) or wait for more data?	information	neutral
1459288710143520000	https://twitter.com/twitter/statuses/1459288710143520770	Fri Nov 12 22:35:15 +0000 2021	@ygkcouple Do you happen to know if they are requiring proof of vaccine?	information	neutral
1459288685384540000	https://twitter.com/twitter/statuses/1459288685384548368	Fri Nov 12 22:35:09 +0000 2021	@packetsniffer99 @KoenSwinkels So it’s not a vaccine and it’s not working…	efficacy	negative
1459288348904890000	https://twitter.com/twitter/statuses/1459288348904894480	Fri Nov 12 22:33:49 +0000 2021	@RStewart321 Let me ask my commie brother who won't talk to me anymore because of my vaccination status.	unvax	negative
1459287797634840000	https://twitter.com/twitter/statuses/1459287797634846720	Fri Nov 12 22:31:37 +0000 2021	Colorado Gov. Jared Polis has signed an executive order declaring all of Colorado to be at high risk from COVID-19, thereby making all adults eligible to receive vaccine booster shots.	information	neutral
1459287714004560000	https://twitter.com/twitter/statuses/1459287714004566016	Fri Nov 12 22:31:17 +0000 2021	@AreOhEssEyeEe @CBC We are literally given an open. Fall off the right cliff and get heart conditions with the vaccine. Or fall off the left cliff and have no food. No fun. No privileges by not getting the vaccine.	mandates	negative
1459287667871340000	https://twitter.com/twitter/statuses/1459287667871346690	Fri Nov 12 22:31:06 +0000 2021	@Stephwolfe101 If it required lying or fraud, no. If the teen was 14 or over, or emancipated, and had decided for him/herself that vaccine was wanted, I’d have no problem providing transportation. If younger, I’d be willing to help talk with parents about it.	children	negative
1459287418830560000	https://twitter.com/twitter/statuses/1459287418830565387	Fri Nov 12 22:30:07 +0000 2021	@DoctorOntario Lol, I think she mixed up who is ending up with heart attacks, and nobody is dying at home from covid, hasn’t she been watching the news, the hospitals are to the brink	spread	positive
1459287404192400000	https://twitter.com/twitter/statuses/1459287404192403463	Fri Nov 12 22:30:04 +0000 2021	@globeandmail China can't even be honest/trustworthy... at least the government. After they blamed everyone else for covid-19 when it came from their country. I wouldn't do business with china	political	neutral
1459287258171770000	https://twitter.com/twitter/statuses/1459287258171772929	Fri Nov 12 22:29:29 +0000 2021	@BLew_16 So if the vaccinated are the real heroes, then they must have put themselves at risk by taking the vaccine. Thus, it follows then that the vaccine isn't safe if it put them at risk. So it's time to stop vaccine madness and mandates.	unvax	negative
1459287216639850000	https://twitter.com/twitter/statuses/1459287216639856649	Fri Nov 12 22:29:19 +0000 2021	@CFosee @MercedesGlobal It’s about Mercedes regurgitating that crap Economist article saying Canada wouldn’t see widespread Covid vaccination until 2022. They cited our geographic challenges as a reason, amongst other things. It was so wrong, it’s laughable and another example of how #CdnMediaFails	political	neutral
1459287192723980000	https://twitter.com/twitter/statuses/1459287192723988481	Fri Nov 12 22:29:13 +0000 2021	Global vaccine inequity is a stain on nations who gobbled up enough doses to vaccinate their populations 5x over while health workers around the world go to work everyday with their life on the line.\n\nIt's an indictment of pharma companies who've put profits in front of people.	political	positive
1459287154778000000	https://twitter.com/twitter/statuses/1459287154778009602	Fri Nov 12 22:29:04 +0000 2021	Yay!!!!! He got his first dose today, after recently having said he doesn't believe covid is real. That makes me happy ☺️.. Guess I owe him concert tickets for xmas now 😅😂 #GetVaccinated	unvax	positive
1459287129951850000	https://twitter.com/twitter/statuses/1459287129951858689	Fri Nov 12 22:28:58 +0000 2021	@melJsaysso @SlaggitySlag @GodsteapotB @CoxeAnne @rattyratkinson Irrelevant. The point made earlier is some kids in some places can consent to an experimental vaccine without their parents consent. This is a proven fact that you disagreed with	children	negative
1459286755128050000	https://twitter.com/twitter/statuses/1459286755128057860	Fri Nov 12 22:27:29 +0000 2021	Show #25 Nov. 15 - Carm Bozzo &amp; Jerusha Mack from @HaltonWomensPl ; Nick Anastasopoulos &amp; Kerry Davren @cityburlington Building &amp; By-Law Dept. News: @Jo_Brant vaccine mandate; @RBGCanada Winter Wonders exhibit; Burl. Runners Club Blue Ribbon run; Burlington 2022 Budget Town Hall.	information	neutral
1459286610239970000	https://twitter.com/twitter/statuses/1459286610239971329	Fri Nov 12 22:26:54 +0000 2021	@kallmemeg What about infections vs vaccine induced immunity?	information	neutral
1459286373169610000	https://twitter.com/twitter/statuses/1459286373169610756	Fri Nov 12 22:25:58 +0000 2021	@bertrand_boily No for the vaccine 🤣🤣	unvax	positive
1459286244895110000	https://twitter.com/twitter/statuses/1459286244895113222	Fri Nov 12 22:25:27 +0000 2021	@William90727434 @KFLAPH The vaccine really helped that group!	children	positive
1459286102070620000	https://twitter.com/twitter/statuses/1459286102070620162	Fri Nov 12 22:24:53 +0000 2021	Premier Jason Kenney announces that Alberta has received 5,000 doses of the Jansen COVID-19 vaccine. He expects another 15,000 to arrive soon.	information	neutral
1459286061960470000	https://twitter.com/twitter/statuses/1459286061960478723	Fri Nov 12 22:24:44 +0000 2021	Nurses Callie and Hannah work tirelessly each day to keep mothers &amp; birthing people safe from COVID-19. With the recent surge in cases and hospitalizations, the message is clear -- thank health care heroes by getting the vaccine.	spread	positive
1459286035272110000	https://twitter.com/twitter/statuses/1459286035272114178	Fri Nov 12 22:24:37 +0000 2021	BREAKING: Newsmax, the far right “news” outlet that has been aggressively pushing anti-vaccine messaging, announces it will be implementing a vaccine mandate for its employees. RT TO EXPOSE THEIR HYPOCRISY!	unvax	positive
1459286016397910000	https://twitter.com/twitter/statuses/1459286016397918214	Fri Nov 12 22:24:33 +0000 2021	If you get side effects from Joe Biden’s #COVID19 vaccine mandate, too bad! \n\nThe government likely won’t compensate you. \n\nBut if you come to the country illegally, Joe Biden will pay you $450,000.	political	negative
1459285656849420000	https://twitter.com/twitter/statuses/1459285656849420292	Fri Nov 12 22:23:07 +0000 2021	@lumber813 @charlesadler Yes it 100% matters, because there is no good reason to have forced Jews to wear yellow stars. But there is a scientifically provable reason to have vaccine passports to keep the general population safe. So in comparing the two, you’re saying Jews carried a spreadable disease.	mandates	positive
1459285590180910000	https://twitter.com/twitter/statuses/1459285590180917249	Fri Nov 12 22:22:51 +0000 2021	@ChristianPost Well that’s a load of doodoo, if you catch my drift. Where in the Bible are vaccine mandates deemed a sin? First of all, there were no vaccines back then. Secondly, there are hundreds of thousands of Christians who have have willingly been vaccinated as the right thing to do!	political	positive
1459285344952670000	https://twitter.com/twitter/statuses/1459285344952672256	Fri Nov 12 22:21:53 +0000 2021	@M9Scarlett @KimJone04052805 @MarcScottEmery @Metabo_PhD @WesternU @jordanbpeterson @GadSaad @RubinReport To be a public health hazard? Was he actively smoking? Did he have covid?\n\nI believe the word you're looking for is - potentially.\n\nYou can be arrested for *potentially* being a health hazard. \n\nWell, open the doors, we're all going to jail then.	mandates	negative
1459285259015630000	https://twitter.com/twitter/statuses/1459285259015630855	Fri Nov 12 22:21:32 +0000 2021	@LauraMy94524836 @Gov_NB Haha I had to try something - pessimism was starting to take a toll. I laugh but from the circuit breakers to all the covid deaths to the strike now about to enter a third week, it’s been a dark fall in NB.	political	neutral
1459284841036450000	https://twitter.com/twitter/statuses/1459284841036451840	Fri Nov 12 22:19:52 +0000 2021	@chadloder My mom who is an Auchwitz survivor from Vienna Austria, who spent ages 13-21 either in hiding, in prison or in Camp before being liberated, got the vaccine. What do they know about freedom and medicine and sacrifice that she doesn’t?	mandates	positive
1459284695003410000	https://twitter.com/twitter/statuses/1459284695003414538	Fri Nov 12 22:19:18 +0000 2021	I received mixed doses, first Pfizer then moderna, will it matter which booster I get? Like is a back to back moderna more effective than a Pfizer sandwich?	information	positive
1459284430376210000	https://twitter.com/twitter/statuses/1459284430376210433	Fri Nov 12 22:18:15 +0000 2021	@ScottBilleck New restrictions don't affect me in the least!  I was anticipating much more\n\nHowever, I just wish Health Canada would approve the vaccine for kids 5 and up	children	positive
1459284317062970000	https://twitter.com/twitter/statuses/1459284317062979585	Fri Nov 12 22:17:48 +0000 2021	@ceciliaaraneda So far it feels like their part is for us to do our part.\n- Checked for vaccination but not much else\n- Heard 1 reminder about masks.\n- Masks were not enforced in my area as number of people were mask less for entire game or periods.\n- Not sure what they are doing 4 ventilation.	information	positive
1459284279230350000	https://twitter.com/twitter/statuses/1459284279230353412	Fri Nov 12 22:17:39 +0000 2021	@elliottkrista @Tim_Bousquet The only way to get to covid zero is by non pharmaceutical mitigation	efficacy	negative
1460016807297700000	https://twitter.com/twitter/statuses/1460016807297708036	Sun Nov 14 22:48:27 +0000 2021	Biden went too far. This ridiculous vaccine mandate will be a failure from which he never recovers.	political	negative
1460016573968790000	https://twitter.com/twitter/statuses/1460016573968793600	Sun Nov 14 22:47:31 +0000 2021	Boycott Revelstoke Mountain Resort in BC Canada and their fascist vaccine mandate !	mandates	negative
1460016519300230000	https://twitter.com/twitter/statuses/1460016519300235270	Sun Nov 14 22:47:18 +0000 2021	@lmauricecpr @lisaaanne2 I’m in ON Canada. Masks are mandated, and we all wear them! NO BIG DEAL! But we do have our anti vaxxers. Including our Premier’s own family. It’s the vaccine passports that are in place that’s  throwing the anti’s panties in a knot. My huge beef, he’s going to lift them! 😡🇨🇦	political	positive
1460016433593650000	https://twitter.com/twitter/statuses/1460016433593651203	Sun Nov 14 22:46:58 +0000 2021	@TimJDillon Yes Covid cases are rising but funny enough hospitalization rates and death rates still largely affecting the unvaccinated it’s like the non-VAX’r will look at any piece of information false or true to prove their argument,🤷🏼‍♂️ face it folks the vaccines are working.	efficacy	positive
1460016359153150000	https://twitter.com/twitter/statuses/1460016359153156096	Sun Nov 14 22:46:40 +0000 2021	They’re not vaccine passports they’re digital prison apps because even if you get your jab , you’re only on probation with time off for good behaviour...reviewed every 3-6 months.\n\nDo you really want to live like that?🤔	mandates	negative
1460016226432780000	https://twitter.com/twitter/statuses/1460016226432786433	Sun Nov 14 22:46:08 +0000 2021	We're doomed as a society when a label of flu shot, which is a vaccine, told to me it's not a vaccine. Ah yes, customer let me tell you about the flu-shot-vaccine we've had year to year and how you're more knowledgeable about a job you don't do and are such an expert at fallacies	unvax	positive
1460016158019440000	https://twitter.com/twitter/statuses/1460016158019448838	Sun Nov 14 22:45:52 +0000 2021	@Liberalism2021 @kinsellawarren I wouldn't go this far right now as thankfully in Canada our covid cases nowhere near that, but I think any crowded place should be for vaccinated only.  Unvaccinated can still go outside but no gatherings.	mandates	positive
1460016108652540000	https://twitter.com/twitter/statuses/1460016108652548098	Sun Nov 14 22:45:40 +0000 2021	Comparing COVID vaccination to the holocaust is anti-Semitic. \n\nPeriod. \n\n#ableg #abpoli #cdnpoli	unvax	neutral
1460016051895370000	https://twitter.com/twitter/statuses/1460016051895377927	Sun Nov 14 22:45:27 +0000 2021	Joe Biden's vaccine mandate is unconstitutional and illegal. \n\nPass it on.	mandates	negative
1460015885129680000	https://twitter.com/twitter/statuses/1460015885129687041	Sun Nov 14 22:44:47 +0000 2021	I know that, but as a nurse here in Florida and all over they’re way to many medical professionals that are against the vaccine and apparently are against science and therefore need to be terminated from their jobs.	mandates	positive
1460015855081770000	https://twitter.com/twitter/statuses/1460015855081771012	Sun Nov 14 22:44:40 +0000 2021	Joe Biden’s vaccine mandate is violence.\n\nDirecting OSHA to implement the vaccine mandate is an abuse of power.	mandates	negative
1460015716183200000	https://twitter.com/twitter/statuses/1460015716183203843	Sun Nov 14 22:44:07 +0000 2021	Joe Biden’s vaccine mandate will force companies to fire truck drivers delivering goods for the holidays. \n\nTruck drivers! Who work alone in the cab of a truck all day long.	mandates	negative
1460015708092300000	https://twitter.com/twitter/statuses/1460015708092305414	Sun Nov 14 22:44:05 +0000 2021	@asnordvik @351ScientzCFC @ecniuq_ @lindsey_peacher @hawkinscm12 @TimJDillon Neither COVID-19 disease nor the new COVID-19 vaccines have shown evidence of causing ADE.	side_effect	positive
1460015417087290000	https://twitter.com/twitter/statuses/1460015417087299585	Sun Nov 14 22:42:55 +0000 2021	@skrymir42 @WoodBuffaloSens @That80sG @LalimesMartian @Media_Sens @NHL @NHLFlames Have a good time restricting yourself to covid rules for the next 10 years, I can promise not a single person in the real world cares about them👋	mandates	negative
1460015241555620000	https://twitter.com/twitter/statuses/1460015241555628035	Sun Nov 14 22:42:14 +0000 2021	@JuanIsMe @CCCAlliance Especially when the “science” underlying such a demand is demonstrably fraudulent (aka: a lie). \n\nWe can work together to support vaccination programs that work, for this crisis or a future one.\n\nBut if you are suggesting that it’s okay for people to be forced into a shot… 2/	mandates	negative
1460014741380870000	https://twitter.com/twitter/statuses/1460014741380870147	Sun Nov 14 22:40:14 +0000 2021	@breakfasttv Why are we getting a,second vaccine shot...ther are more persons getting covid then those with only one dose? Whats really going on 🤔🤔...does anyone have answers? Plus we got 2 doses...but covid cases keeps rising...Really...what is going on? Anyone🤔?	efficacy	neutral
1460014604331840000	https://twitter.com/twitter/statuses/1460014604331847682	Sun Nov 14 22:39:42 +0000 2021	@BarefootFred1 @MiraLestrange @ReutersFacts Ever notice how these stories come from unverified anonymous accts aka bots, yet the covid stories come from real verifiable accts and often healthcare workers?	efficacy	negative
1460014582525670000	https://twitter.com/twitter/statuses/1460014582525673473	Sun Nov 14 22:39:36 +0000 2021	@JuanIsMe @CCCAlliance That’s 18. You’ll find many, many more if you try. Let my be clear, @JuanIsMe: I support you and your choice to take the shot. I do not support anybody telling someone else they have to take any medical product under duress, be it a vaccine, pill, or anything else. 1/	mandates	negative
1460014282314330000	https://twitter.com/twitter/statuses/1460014282314338305	Sun Nov 14 22:38:25 +0000 2021	The U.S. administered almost 10 million vaccine doses in the last week, the most since late May, according to the White House.	information	neutral
1460014065762250000	https://twitter.com/twitter/statuses/1460014065762254850	Sun Nov 14 22:37:33 +0000 2021	@Notbuyingthisbs I am getting so tired of explaining this. How hard is it to think about what the vaccine is doing, and how it will impact the spread/impact of the virus in the population?	spread	positive
1460014016785520000	https://twitter.com/twitter/statuses/1460014016785522693	Sun Nov 14 22:37:22 +0000 2021	Have once again started hearing- this friend has covid, that relative has covid. Please mask up, stay safe.	mandates	positive
1460013879761650000	https://twitter.com/twitter/statuses/1460013879761653766	Sun Nov 14 22:36:49 +0000 2021	@DrTomFrieden Yes, I totally agree, and these additional vaccines need to be distributed worldwide and in enough numbers to ensure that we achieve near-universal vaccination across the globe.	spread	positive
1460013817228920000	https://twitter.com/twitter/statuses/1460013817228926981	Sun Nov 14 22:36:34 +0000 2021	The U.S. has added 5.6 million jobs since President @JoeBiden took office. \n\nThis recovery was sparked by the American Rescue Plan putting money directly in the hands of working families and launching one of the fastest mass vaccination campaigns ever.	political	positive
1460013736765230000	https://twitter.com/twitter/statuses/1460013736765231106	Sun Nov 14 22:36:15 +0000 2021	@kosheralcoholic @ElectionWiz Thats right. Nearly 800,000 are dead from covid. It's a scam. Anything under 2 million dead is insignificant.	political	negative
1460013674140080000	https://twitter.com/twitter/statuses/1460013674140082178	Sun Nov 14 22:36:00 +0000 2021	@DrTomFrieden Agreed 100%.   Only vaccine kills and mitigates the virus.  Pseudo science and horse laxative do not .	efficacy	positive
1460013166826510000	https://twitter.com/twitter/statuses/1460013166826512387	Sun Nov 14 22:33:59 +0000 2021	@clif_high Let me just add\nIf your blood type is  A+or A-\nYou might be at risk of moderna clots	side_effect	negative
1460012970361110000	https://twitter.com/twitter/statuses/1460012970361114626	Sun Nov 14 22:33:12 +0000 2021	@KiminLa @NBCNews Quite a number of researchers have been complaining recently about peer review papers getting edited or bounced where they don't agree with general government narratives. There is no doubt but that there is some censorship going on with regard to covid.	efficacy	negative
1460012943756560000	https://twitter.com/twitter/statuses/1460012943756562434	Sun Nov 14 22:33:06 +0000 2021	@Oilerfan9911 @CupeAB Equally polio has ripped through the Middle East, Rubella has never been defeated and tbh this isn’t and should be called a vaccine as it’s not. Nits a flu shot at best.  Notice you got vaccines as a child in serious and that was it.	efficacy	negative
1460012857639290000	https://twitter.com/twitter/statuses/1460012857639292936	Sun Nov 14 22:32:45 +0000 2021	@RichardRude6 @CityNewsTO Then why are you complaining? If you got two shots I'd assume you're reasonable enough to understand the vaccine is necessary to end the pandemic and these measures seeking to push most people to get it, are precisely trying to achieve that..I don't understand your reasoning.	efficacy	positive
1460012729305940000	https://twitter.com/twitter/statuses/1460012729305944074	Sun Nov 14 22:32:15 +0000 2021	Had dinner last night with friends who are &lt; 60 and more than 6 months out from their 2nd mRNA vaccine dose. I told them to get a booster. The current requirement for a high risk job or high risk med condition in people 18 - 60 is misplaced and almost certain to change.	spread	positive
1460012577249910000	https://twitter.com/twitter/statuses/1460012577249918977	Sun Nov 14 22:31:38 +0000 2021	@Oilerfan9911 @CupeAB Yeah and there are still people dying even with the Covid vaccine.  There’s also many that have had adverse effects and now have lifelong side effects as well as deaths…	side_effect	negative
1460012517166660000	https://twitter.com/twitter/statuses/1460012517166665730	Sun Nov 14 22:31:24 +0000 2021	@Golden_Pup They promise 'just wait till vaccines', then Covid waves will end and we'll give you your life and freedoms back'.  We now know that was a lie.  Waves to continue indefinitely.  So when will overlords give us our lives back now? #covidmyths	efficacy	negative
1460012510803900000	https://twitter.com/twitter/statuses/1460012510803906567	Sun Nov 14 22:31:22 +0000 2021	@nationalpost Or, O'Fool's flip flopping.\nOr, O'Fool's lack of control over the party.\nOr, O'Fool's lame stance on vaccine mandates.\nOr.....	political	neutral
1460011912515790000	https://twitter.com/twitter/statuses/1460011912515796992	Sun Nov 14 22:29:00 +0000 2021	@CTVNews Or.....it could be the vaccine	side_effect	negative
1460011880273960000	https://twitter.com/twitter/statuses/1460011880273965059	Sun Nov 14 22:28:52 +0000 2021	Tesco is the latest company to show its support for medical apartheid with Santa showing his proof of vaccination.\n\nWhat are you selling? Food, or agenda?\n\n#BoycottTesco	mandates	negative
1460011870010710000	https://twitter.com/twitter/statuses/1460011870010716161	Sun Nov 14 22:28:50 +0000 2021	Thinking back though the last 6 days, I have literally watched 9 covid+ people take their last breath - all unvaccinated - families heartbroken and wondering why. \n\nUNVACCINATED\n\nI’m out of words for people who are unwilling to get a statistically tremendously safe vaccine.	unvax	positive
1460011810392880000	https://twitter.com/twitter/statuses/1460011810392883209	Sun Nov 14 22:28:35 +0000 2021	@dwarrilow2002 @dscseedguy Sorry, but I don't need any of that as I trust the trained medical professionals to interpret the data and advise accordingly. \nI am fortunate in being eligible, because of age, for my third vaccination later this week.	efficacy	positive
1460011800406060000	https://twitter.com/twitter/statuses/1460011800406069248	Sun Nov 14 22:28:33 +0000 2021	The mandate isn't about a vaccine.\n\nIt's about giving the ruling class power to track everything you do.	mandates	negative
1460011658059910000	https://twitter.com/twitter/statuses/1460011658059915270	Sun Nov 14 22:27:59 +0000 2021	@DrNeilStone Literally cut off a friend yesterday after her whining on a FB post that she was going to lose her job because of the vaccine mandate when she works in the same building as one of my husband’s best friends. So over this BS	unvax	positive
1460011654922390000	https://twitter.com/twitter/statuses/1460011654922395649	Sun Nov 14 22:27:58 +0000 2021	@impishchimp It’s definitely an extreme. I disagree with it, from a mobility rights perspective. I agree with vaccine mandates and proof of vaccination, but this is reminiscent of far right regimes. In terms of courage: European gov’ts got it	mandates	neutral
1460011550115340000	https://twitter.com/twitter/statuses/1460011550115344400	Sun Nov 14 22:27:33 +0000 2021	@raygaurca @IanGFoss Sure, but policy makers do not view this as an emergency.  Yes, great things said at a mic, flatten curves, save healthcare from overload.  Yah yah.  No plan, vaccines are a tool, not a plan.  I wish them well.  I’m looking at post peak Covid, like 2025 or so.	efficacy	negative
1460011352756470000	https://twitter.com/twitter/statuses/1460011352756473862	Sun Nov 14 22:26:46 +0000 2021	💥The Double-Jabbed are Dying at a 6 Times Higher Rate than the Unvaxxed!💥\n(Mercola dot com 11/10/21)  RT!!\n\nRecent data from the U.K. Office of Nat'l Statistics reveals people who have gotten 2 covid jabs are dying from all causes at a rate six times higher than the unvaxxed.	unvax	negative
