id	link	date	text	category	sentiment
1459298107238320000	https://twitter.com/twitter/statuses/1459298107238322181	Fri Nov 12 23:12:35 +0000 2021	@jmrz @bennessb Canada has been mixing and matching first and second doses my third dose will probably be a moderna where my first two were a Pfizer	political	neutral
1459298064473200000	https://twitter.com/twitter/statuses/1459298064473206784	Fri Nov 12 23:12:25 +0000 2021	Some late Friday changes to NL COVID rules:\nGatherings at an arts centre, wedding, funeral, religious service can operate at full capacity with NO physical distancing (must wear a mask, proof of vax), as long as food isn't being served #covid19nfld	information	neutral
1459297907375360000	https://twitter.com/twitter/statuses/1459297907375366144	Fri Nov 12 23:11:48 +0000 2021	@wdnot40 @roussin_brent smoking is a addiction. choosing not to get a vaccine is plain stupidity and selfishness.	unvax	positive
1459297853738820000	https://twitter.com/twitter/statuses/1459297853738823680	Fri Nov 12 23:11:35 +0000 2021	BOOM! Washington State University has fired its football coach, Nick Rolovich, for failing to comply with the state's vaccine mandate.\n\nRetweet to thank Washington State University for staying strong!	mandates	positive
1459297795601570000	https://twitter.com/twitter/statuses/1459297795601571840	Fri Nov 12 23:11:21 +0000 2021	York Region is reporting 51 new cases of covid today. For comparison last Friday 32 cases were reported	information	neutral
1459297652349470000	https://twitter.com/twitter/statuses/1459297652349476865	Fri Nov 12 23:10:47 +0000 2021	@donlemon We're you aware the CDC doesn't collect data on the question of if people who've had covid could pass it on if they get sick again, despite antibodies	political	negative
1459297572871290000	https://twitter.com/twitter/statuses/1459297572871294981	Fri Nov 12 23:10:28 +0000 2021	@bubly2021 @BernieSpofforth @GremlinPeppa Did some research. Arrest would be for trespassing. Police are only called when someone who is not wearing a mask refuses to leave the premises. Probably also now that vaccines are mandated, if they don’t have vaccine passport &amp; won’t leave. At least in BC.	mandates	neutral
1459297533587430000	https://twitter.com/twitter/statuses/1459297533587439620	Fri Nov 12 23:10:19 +0000 2021	@PekalaLaw I can't wait for the climate change vaccine	efficacy	negative
1459297146264560000	https://twitter.com/twitter/statuses/1459297146264563713	Fri Nov 12 23:08:46 +0000 2021	My 14 year old daughter told me she would like to know about the vaccine and why we have chosen not to get it. I think it would really help to just show her the raw data. Please share your links below to articles, including main stream news articles. I want her to see both sides	information	negative
1459297119068640000	https://twitter.com/twitter/statuses/1459297119068643333	Fri Nov 12 23:08:40 +0000 2021	BREAKING: A San Francisco police officer who REFUSED to receive the COVID vaccine and was was placed on leave for failing to follow health requirements...\n\n...Has died after contracting COVID. 🤨	mandates	positive
1459297044254880000	https://twitter.com/twitter/statuses/1459297044254887944	Fri Nov 12 23:08:22 +0000 2021	@Rschooley Counterpoint: No one actually regrets getting the vaccine.	unvax	positive
1459296859672000000	https://twitter.com/twitter/statuses/1459296859672002562	Fri Nov 12 23:07:38 +0000 2021	I don't care if Aaron Rodgers got the vaccine or not it's his body it's his choice it's nobody else's business	political	negative
1459296751098150000	https://twitter.com/twitter/statuses/1459296751098159109	Fri Nov 12 23:07:12 +0000 2021	@TaborTimeYT I wish I could go to the theatre but I don’t have a “vaccine passport” benefits of living in Canada lol	mandates	negative
1459296419177660000	https://twitter.com/twitter/statuses/1459296419177660416	Fri Nov 12 23:05:53 +0000 2021	If the covid vaccines aren’t working very well now, the most likely inference is that they never worked very well, not that they would work well if we submitted to more shots.	efficacy	negative
1459296357701790000	https://twitter.com/twitter/statuses/1459296357701799936	Fri Nov 12 23:05:38 +0000 2021	@robferguson1 Let him know Simcoe Muskoka PHU allows water shut off saying it's not a Public Health risk#ramara#dunlop#covid	political	positive
1459296354304330000	https://twitter.com/twitter/statuses/1459296354304335874	Fri Nov 12 23:05:37 +0000 2021	@BarbaraCastor2 @_pilot_pirx @swimmingthegrey @Leftylockdowns1 I would think the vaccinated would be outraged everytime they say the vaccine will end the pandemic. It hasn't anywhere. #livewithcovid	unvax	negative
1459296103220720000	https://twitter.com/twitter/statuses/1459296103220723713	Fri Nov 12 23:04:38 +0000 2021	ONTARIO, an assoc. I belong to is having it's Christmas party at the Legion. The invitation says "double vaccination proof/ID required". I will NOT be going. Ironic that an establishment for those that fought for our Freedom requires you to forfeit your Freedom to attend.	mandates	negative
1459296050687230000	https://twitter.com/twitter/statuses/1459296050687234048	Fri Nov 12 23:04:25 +0000 2021	@OntarioKelli I'm so sorry Kelli, we just seem to be going in circles with covid!!\n\nI am praying for everyone affected by this outbreak.	spread	neutral
1459295726303910000	https://twitter.com/twitter/statuses/1459295726303911945	Fri Nov 12 23:03:08 +0000 2021	My son got his first Covid vaccine today. \n\nHe hates needles and was upset at first, but toughened up immediately when I reminded him that we are fighting the virus that killed his grandpa. \n\nIt was a proud parent moment for me.	children	positive
1459295723602590000	https://twitter.com/twitter/statuses/1459295723602595845	Fri Nov 12 23:03:07 +0000 2021	@cmaconthehill @MBernardoNews Great!  \n\nIt is now 6 months &amp; four days since my second AZ vaccine.\n\nWhere is my booster, Dr. Bonnie Henry?  \n\nDo I really have to wait until February to get it?\n\nDoes that mean I am currently *not* protected against #COVID19???\n\n#BCpoli #COVID19BC #BoosterShot #DrBonnieHenry	political	positive
1459295717512590000	https://twitter.com/twitter/statuses/1459295717512597506	Fri Nov 12 23:03:06 +0000 2021	"This will all be over once there's a vaccine"	efficacy	negative
1459295574893730000	https://twitter.com/twitter/statuses/1459295574893735937	Fri Nov 12 23:02:32 +0000 2021	People are still talking about “immunocompromised people who can’t get the vaccine” and it’s pissing me off. They’re not live vaccines! Immune compromised people (like me) need the vaccine more than anyone. There are medical reasons to not get vaccinated, but this is not one!	side_effect	positive
1459295492794420000	https://twitter.com/twitter/statuses/1459295492794429445	Fri Nov 12 23:02:12 +0000 2021	@danielkotzin But of course, the plan was never to have effective vaccines like the polio shot so we can take it and be done with Covid and be back to 2019 life.\n\nThe plan was always this freedom-for-subscription model, QR codes for entry, and medical checkpoints in perpetuity.	mandates	negative
1459295479930310000	https://twitter.com/twitter/statuses/1459295479930318849	Fri Nov 12 23:02:09 +0000 2021	You cannot sue vaccine producers.\n\nThey have no liability for their product.\n\nDoes this make you feel good?\n\nCan you think of a business model that exemplifies fiat maximalism more than pharmaceuticals?\n\n#fiatdisease	efficacy	negative
1459295218872630000	https://twitter.com/twitter/statuses/1459295218872635393	Fri Nov 12 23:01:07 +0000 2021	Every time someone explains how some action to fight covid or protect the climate would be nice but is too costly to "the economy" I just want to shout: THE ECONOMY IS AN EMERGENT PROPERTY OF PEOPLE AND ECOSYSTEMS!!	mandates	positive
1459295197410500000	https://twitter.com/twitter/statuses/1459295197410508814	Fri Nov 12 23:01:02 +0000 2021	@bamesbmw @SamIAm2021MD Why is it not working for some people that are fully vaxxed without the vaccine waning. How is it getting though into the cells?	efficacy	negative
1459295135100010000	https://twitter.com/twitter/statuses/1459295135100018697	Fri Nov 12 23:00:47 +0000 2021	@taylorlaj @RebelNewsOnline Do you think one power structure is behind all the vaccine mandates?  I see it as many power structures and many citizens and many health professionals agreeing on an approach.  But hopefully ending as soon as possible as I dislike rules and mandates.	mandates	negative
1459294804014160000	https://twitter.com/twitter/statuses/1459294804014161921	Fri Nov 12 22:59:28 +0000 2021	@CTVAnchor @CTVAtlantic I once served as an active member of the Canadian Military. I was willing to protect this country against all evils no matter the cost. As a veteran, I am willing to carry on those duties and do the same. I got my covid-19 vaccines and got the records to prove it, months ago. 1/2	efficacy	positive
1459294794816140000	https://twitter.com/twitter/statuses/1459294794816143360	Fri Nov 12 22:59:26 +0000 2021	Shorter shorter Press conference: \n1. we have to be careful on vaccine rollout.\n2. vaccines won’t help.\n3. but we can’t tread on anti vaxers feels either\n4. its not that bad. it only looks bad.\n5. we’re going to ignore most of the OMT again.\n6. Let er rip.	unvax	negative
1459294572106890000	https://twitter.com/twitter/statuses/1459294572106891266	Fri Nov 12 22:58:33 +0000 2021	@Leafsgirlfan30 @birgitomo @fordnation @Sflecce Do you think they're going to get rid of covid? (Impossible)\nThey will get better at selling you things that will make you feel a little safer. (How much for a box of masks now?)	efficacy	negative
1459294491479710000	https://twitter.com/twitter/statuses/1459294491479711744	Fri Nov 12 22:58:13 +0000 2021	REMINDER: Vaccinated people also spread COVID. Therefore there’s no possible reason for a vaccine mandate at work. Even if you think the vaccine is effective, it protects no one but the person who took it.\n\nThe most basic truths get lost so easily these days.	efficacy	negative
1459294289612120000	https://twitter.com/twitter/statuses/1459294289612128258	Fri Nov 12 22:57:25 +0000 2021	China says they only had 26 new Covid cases today…in a country of 1.4 billion people…using some shitty Chinese vaccine to inoculate themselves. World class liars; that’s what they are	efficacy	negative
1459294266447080000	https://twitter.com/twitter/statuses/1459294266447085569	Fri Nov 12 22:57:20 +0000 2021	@ctvottawa i see kids walking alone on the sidewalk with masks on, actually i see adults do the same... is covid just floating in the air all the time?	unvax	negative
1459293553692220000	https://twitter.com/twitter/statuses/1459293553692221440	Fri Nov 12 22:54:30 +0000 2021	@ctvwinnipeg Not again when is this nightmare going to end, they should start putting the third vaccine to everyone	mandates	positive
1459293461874670000	https://twitter.com/twitter/statuses/1459293461874675714	Fri Nov 12 22:54:08 +0000 2021	I was in parliament today. \nHouse security discreetly asked to confirm my vaccination status.\nI thanked them.\nEveryone has a right to a safe workspace.\nI look forward to every MP showing up on Nov 22 ready for work - ready to keep colleagues safe.\nOtherwise stay home.	mandates	positive
1459293413103300000	https://twitter.com/twitter/statuses/1459293413103308815	Fri Nov 12 22:53:56 +0000 2021	Biden’s vaccine mandate is just the first step. Next, they’re going to FORCE you to get a vaccine to travel, go to school, have a medical procedure, and go to the grocery store. This is all about CONTROL - zero science!	mandates	negative
1459293028078600000	https://twitter.com/twitter/statuses/1459293028078608387	Fri Nov 12 22:52:24 +0000 2021	Can't emphasize enough that all these recent ableist articles are propaganda to control the narrative during a mass disabling event. It's in the state's best interest to downplay the severity of long covid &amp; reinforce the idea that health can be controlled through "good choices"	mandates	negative
1459292902409090000	https://twitter.com/twitter/statuses/1459292902409097218	Fri Nov 12 22:51:54 +0000 2021	If you experience heart inflammation, heart attacks, strokes, Bell’s Palsy, blood clots, fucked up periods, the inability to move limbs, seizures or death... don’t worry, it just means the vaccine is working.	side_effect	negative
1459292743893600000	https://twitter.com/twitter/statuses/1459292743893602304	Fri Nov 12 22:51:17 +0000 2021	@trendless @Gill25T @politicalham i don't read the article as arguing against boosters. \n\narticle just clarifies that the vaccine protection against severe disease is so far relatively stable.   yes, against infection, some decline. \n\nBut, still offers protection against ending up needing hospital level care	efficacy	positive
1459292691150380000	https://twitter.com/twitter/statuses/1459292691150381057	Fri Nov 12 22:51:04 +0000 2021	Purpose of vaccine passports isn’t to stop transmission of the virus b/c ppl who are vaccinated can still become infected &amp; transmit the virus. Purpose of vaccine passports isn’t to identify ppl who are immune b/c existence of natural immunity being denied. This is about control.	mandates	negative
1459292434593050000	https://twitter.com/twitter/statuses/1459292434593050627	Fri Nov 12 22:50:03 +0000 2021	@FPVaughanIII Considering his hatred of those who don’t want to take the vaccines b/c of legit concerns…and their legal right to SAY NO…I wonder how .@genesimmons feels about this one?  GS does, after all, not spare his comments about vax-hesitant ppl who die from Covid.	unvax	negative
1459292402242530000	https://twitter.com/twitter/statuses/1459292402242535425	Fri Nov 12 22:49:55 +0000 2021	@DJennings2012 @ColinDMello @SeanDavidson_ Because when you're living in a world of proven percentages and risk levels, having a proof of vaccine passport requirement keeps things at a manageable place. A place where less people are dying and our entire healthcare system can keep up.	mandates	positive
1459292020426470000	https://twitter.com/twitter/statuses/1459292020426477572	Fri Nov 12 22:48:24 +0000 2021	@680CJOB I’ll gladly pay before getting an untested vaccine.	efficacy	negative
1459291998779750000	https://twitter.com/twitter/statuses/1459291998779756553	Fri Nov 12 22:48:19 +0000 2021	@ColinDMello @SeanDavidson_ I know of 2 restos that aren't and won't say where and who they need to work...should they yes..but you know what vaccinated people are getting covid more and more so dont know why we are doing this	mandates	negative
1459291978953330000	https://twitter.com/twitter/statuses/1459291978953338880	Fri Nov 12 22:48:14 +0000 2021	@louern @birgitomo Fake news. Those numbers are impossible. Pfizer proved the vaccine is over 90% effective. Stop lying to people.	efficacy	positive
1459291911710290000	https://twitter.com/twitter/statuses/1459291911710294017	Fri Nov 12 22:47:58 +0000 2021	So my child might have asthma 🤦🏻‍♀️ emotional rollercoaster never ends 🎢 I know many of you are in this boat too. How do you deal right now w covid? He’s &lt;5 and in daycare bc of my condition.	children	neutral
1459291866835210000	https://twitter.com/twitter/statuses/1459291866835214343	Fri Nov 12 22:47:48 +0000 2021	#cdnpoli Alberta covid cases levelling out.\n\n7 deaths over two days.\n\n470 cases on Nov. 10.\n371 on Nov. 11.\n\n5,745 active cases.\n\n554 in hospital.\n110 ICU.	information	neutral
1459291862926300000	https://twitter.com/twitter/statuses/1459291862926307337	Fri Nov 12 22:47:47 +0000 2021	“…shows they are effective and can help keep some people out of the hospital. They are generally recommended for early treatment in high-risk unvaccinated individuals or people who may not mount a sufficient immune response to COVID-19 vaccination, such as transplant recipients”	efficacy	positive
1459291800217290000	https://twitter.com/twitter/statuses/1459291800217296902	Fri Nov 12 22:47:32 +0000 2021	This "I got the vax and then got covid but I would have died without the vax" argument shows you just how far gone some of them are. It's a cult. Mental illness.	efficacy	negative
1459291774053220000	https://twitter.com/twitter/statuses/1459291774053228550	Fri Nov 12 22:47:25 +0000 2021	So we need to show proof of vaccine to dine in yet medical staff can care for us in hospital without being vaccinated  @fordnation is spineless. 🤔 #VoteFordOut2022	political	positive
1459291743799720000	https://twitter.com/twitter/statuses/1459291743799726088	Fri Nov 12 22:47:18 +0000 2021	@susiesnoww @CarterDFrost @ctvwinnipeg Did you know that vaccination you have doesn’t work 😂 That is why you all have to wear masks. If it did work, the virus would be all gone by now. Natural immunity is the way to go 👍🏼👍🏼	efficacy	negative
1459291630394040000	https://twitter.com/twitter/statuses/1459291630394040320	Fri Nov 12 22:46:51 +0000 2021	@DrJacobsRad @LeslynLewis @MarilynGladuSL @erinotoole But, but Facebook is so much fun and not boring like some medical journal. By the way, Simcoe Muskoka had a jump in New covid cases. The majority of which are unvaccinated or only partially vaccinated people. GET VACCINATED!!!	spread	positive
1459291629748160000	https://twitter.com/twitter/statuses/1459291629748162565	Fri Nov 12 22:46:51 +0000 2021	@doug_murano @StephenKing Social isolation/limited activities during the pandemic has sped up dementia in many elderly people. It happened to my dad. He passed away at almost 98 in April after catching covid in his seniors rez.	mandates	negative
1459291616963930000	https://twitter.com/twitter/statuses/1459291616963932161	Fri Nov 12 22:46:48 +0000 2021	Biden needs COVID numbers to rise to push his bullshit Vaccine mandate, this is why he's sending COVID-ridden immigrants to a State (FL) that has the lowest COVID cases in the country WITHOUT a mask or vaccine mandate! #herdimmunity is working in Florida!!	mandates	negative
1459291595317150000	https://twitter.com/twitter/statuses/1459291595317157897	Fri Nov 12 22:46:43 +0000 2021	@amunratep I hope you get the vaccine you are looking for. Everyone should be free to make whatever decision is best for them. Good luck.	mandates	negative
1459291486231600000	https://twitter.com/twitter/statuses/1459291486231609347	Fri Nov 12 22:46:17 +0000 2021	@CTVKitchener 3)In France, 208 children were reported to have suffered serious medical side effects (paralysis in 10 cases) after they received the Pfizer vaccine. On 29 September 2021, Slovenia suspended use of the Janssen vaccine following the death of a 20-year-old woman.	side_effect	negative
1459291397522170000	https://twitter.com/twitter/statuses/1459291397522178053	Fri Nov 12 22:45:56 +0000 2021	1/Vax Mandates are Unethical. "It is also unethical to fire people who choose not to get vaxed. Many of the vaccine-hesitant were the heroes of last year – nurses, policemen, firefighters, truckers, &amp; others who kept our society functioning while the laptop class stayed home"	mandates	negative
1459291165065420000	https://twitter.com/twitter/statuses/1459291165065420806	Fri Nov 12 22:45:00 +0000 2021	@TorontoPolice Suspended with pay… yet the city suspends others without pay for not taking a vaccine. We are beyond herd immunity, this isn’t right .	mandates	negative
1459291044659420000	https://twitter.com/twitter/statuses/1459291044659429377	Fri Nov 12 22:44:32 +0000 2021	@jesse94337954 @GlobalOkanagan Really lots of jobs,the vets didn’t serve and die so people could be  anti vaxxers during a global pandemic,they got vaxxed too,no complaints,and vaccines don’t cause sickness and death,Covid 19 does and it spreads to others	unvax	positive
1459290995858850000	https://twitter.com/twitter/statuses/1459290995858853888	Fri Nov 12 22:44:20 +0000 2021	@DoctorOntario I was just in the hospital for a few days almost everyone in the ER was having heart issues.  Should anyone with a vaccine injury receive help ? Lots of scientists and doctor's now claiming it's not as safe as they claim. It's shocking how many evil people are out there.	side_effect	negative
1459290979920270000	https://twitter.com/twitter/statuses/1459290979920273412	Fri Nov 12 22:44:16 +0000 2021	@bionaut111 @RachelNotley 10% of young people that is teenagers and pre-teens develop long covid	children	negative
1459290977420590000	https://twitter.com/twitter/statuses/1459290977420599305	Fri Nov 12 22:44:15 +0000 2021	@jordanbpeterson I wish we have more credible data about vaccinated vs cases and deaths. Are people gaining immunity by vaccination or just because they already had covid?	efficacy	neutral
1459290962585390000	https://twitter.com/twitter/statuses/1459290962585395206	Fri Nov 12 22:44:12 +0000 2021	Anyone else receive a call from Health Canada not identifying your name and telling you to press 1 to find out why there is an issue with your vaccination? Scam.	information	neutral
1459290948429510000	https://twitter.com/twitter/statuses/1459290948429516800	Fri Nov 12 22:44:09 +0000 2021	@JimPopowich @edmontonjournal People who are refusing vaccination are turning into social problems.\n\nThey have been fired from their jobs and rejected from their families. Do you think they'll just go away? No, they're radicalized now.\n\nOnly authoritarians support the vaccine mandates.	mandates	negative
1459290748856270000	https://twitter.com/twitter/statuses/1459290748856279040	Fri Nov 12 22:43:21 +0000 2021	@Robdissident @Jenna_bee__ @CP24 I actually have a number of comments.\n\n1) Sweden is being measured against the worst of the worst, and ranking with them\n\n2) Sweden had a massive death rate in the beginning of the pandemic, and is only leveling out now due to high vaccination rates.	efficacy	positive
1459290492441660000	https://twitter.com/twitter/statuses/1459290492441661445	Fri Nov 12 22:42:20 +0000 2021	@CTVKitchener 1) In Europe, each government has a different vaccination policy. The French Government has embarked on a ‘vaccination’ programme for children aged 12 to 17. In Sweden, Germany and Switzerland, for the same age group, either vaccination has been delayed or take-up is low(3).	children	neutral
1459290481951650000	https://twitter.com/twitter/statuses/1459290481951653895	Fri Nov 12 22:42:17 +0000 2021	We have been divided by vaccination status.\n\nThe first priority of this new world that we are building will be to provide access to a livelihood for those that have lost theirs.\n\nThis will require many of us in every region.\n\nThis is what we are doing. \n\nIt can be done.\n\n_\n\nTEAMS	mandates	negative
1459290345561370000	https://twitter.com/twitter/statuses/1459290345561378820	Fri Nov 12 22:41:45 +0000 2021	As of today, 14.6% of all Canadians over age 12 are considered second-class citizens based on vaccination status. Supposedly, Canada values freedom, inclusivity and equal rights. This is a huge step in the opposite direction. It's time to get back to Canadians being Canadian.	children	negative
1459290336925260000	https://twitter.com/twitter/statuses/1459290336925265920	Fri Nov 12 22:41:43 +0000 2021	Great presentation from the team behind Health TrueInfo - the multilingual Android app which aims to innovate the social media approach to tackling COVID-19 vaccine misinformation and hesitancy in Bolivia, India, and Canada @healthtrueinfo	information	positive
1459290315433680000	https://twitter.com/twitter/statuses/1459290315433689091	Fri Nov 12 22:41:38 +0000 2021	@TorontoStar While they allow water to be shut off in RAMARA Township part of Simcoe County,#covid#ford#dunlop#ramara	political	negative
1459290215047110000	https://twitter.com/twitter/statuses/1459290215047118852	Fri Nov 12 22:41:14 +0000 2021	@pfrancey @NaheedD @raehanbobby One local hospital had &lt;1% staff refuse vaccines, very few of that were healthcare professionals; most (not all) were support staff like kitchen and portering. Healthcare professionals mostly so excited to be vaccine eligible—texting colleagues on days off etc to get the jab!	mandates	neutral
1459289958368300000	https://twitter.com/twitter/statuses/1459289958368301066	Fri Nov 12 22:40:13 +0000 2021	Why do working people have to get a vaccine but welfare people don’t?\n\nStop all mandates now!	mandates	negative
1459289955902100000	https://twitter.com/twitter/statuses/1459289955902103558	Fri Nov 12 22:40:12 +0000 2021	My GP just told me that he can't give me a temporary (one month) exemption, but that having a second covid vaccine might give me neurological impairment, based on my prior reaction. "It's a horrible situation," he said.	side_effect	negative
1459290000000000000	https://twitter.com/twitter/statuses/1459289880752640000	Fri Nov 12 22:39:54 +0000 2021	@dpakman Had Covid- now have had two Pfizer shots.  Side effects of vaccination were unpleasantly like having a light dose of Covid but not nearly as bad as being hospitalized, very sick, or suffering from long Covid…just saying…	side_effect	positive
1459289775014350000	https://twitter.com/twitter/statuses/1459289775014359043	Fri Nov 12 22:39:29 +0000 2021	@jencludwig05 Thank you for your support. If more vaccinated people felt this way, we could make some major headway against these vaccine passports in particular.	mandates	negative
1459289755410220000	https://twitter.com/twitter/statuses/1459289755410223108	Fri Nov 12 22:39:24 +0000 2021	@CTVNews I'm old enough to remember when @CTVNews and all other media plus our PM and Tam saying every vaccine was "safe and effective" we've all been sold a lie	efficacy	negative
1459289641157160000	https://twitter.com/twitter/statuses/1459289641157160962	Fri Nov 12 22:38:57 +0000 2021	@Superno_1111 And the vaccine is near useless	efficacy	negative
