1459290935968382977	https://twitter.com/twitter/statuses/1459290935968382977	Fri Nov 12 22:44:06 +0000 2021	@TruegritG I have hesitated getting the vaccine bc of having a reaction to flu shot 2020 - Nov.6 to Dec,18 - my dr said I was fighting off a cold?! - told me to take moderna or pfizer - that was in March of this year  - I said it was not a cold - have not got the shot - do not trust medical
1459274319314534400	https://twitter.com/twitter/statuses/1459274319314534400	Fri Nov 12 21:38:04 +0000 2021	BREAKING REPORT: European drug regulator EMA is investigating REPORTS OF A 'RARE' AND SERIOUS BLOOD CONDITION in recipients of Moderna’s mRNA COVID-19 vaccine..
1459271922001362947	https://twitter.com/twitter/statuses/1459271922001362947	Fri Nov 12 21:28:32 +0000 2021	@TraderJigsaw well health canada didnt do this process with pfizer or moderna, otherwise they would have known the high side effects.  how much is the Government getting paid from Pfizer?  If they truly wanted to end this, they would allow all tools possible.   Something is really fishy
1459265291259686918	https://twitter.com/twitter/statuses/1459265291259686918	Fri Nov 12 21:02:11 +0000 2021	@MDrelichman @GovCanHealth Remember the many issues with AstraZeneca? Led to a major loss of confidence.\nAnd a drop in the vaccination rate.\nWe cannot afford to have that happen with the vaccine for kids\nAnd I doubt the data is sitting in a drawer
1459264518312402946	https://twitter.com/twitter/statuses/1459264518312402946	Fri Nov 12 20:59:07 +0000 2021	@NIHDirector @CDCgov @pfizer @moderna_tx @JanssenGlobal Would you join us for the final evening of our discussion of The Language of God on Monday November 22 (on Zoom)? We’re loving the book and it’s been a great discussion! It would be so awesome to have you there!
1459263344922222592	https://twitter.com/twitter/statuses/1459263344922222592	Fri Nov 12 20:54:27 +0000 2021	If the Pfizer, moderna and AstraZeneca vaccines were sold on amazon, how many people would buy after reading customer feedback 🤔...
1459246801329004545	https://twitter.com/twitter/statuses/1459246801329004545	Fri Nov 12 19:48:43 +0000 2021	NEW: Health Canada has approved the Moderna vaccine for booster shots in Canada. \nThey should be given 6 months after 2nd dose\n#cdnpoli
1459245209569488899	https://twitter.com/twitter/statuses/1459245209569488899	Fri Nov 12 19:42:24 +0000 2021	@spearster55 Astra Zeneca vaccine? I’m looking at Pfizer and Moderna as those are the two predominant vaccines in this country
1459234108081647626	https://twitter.com/twitter/statuses/1459234108081647626	Fri Nov 12 18:58:17 +0000 2021	Now Germany is stopping the Moderna C19 vaccine for the under-30 age.\n\nFrance and half a dozen countries already did so; not yet the vaccine fanatics in the US.\n\nWhy does this vaccine create a heart issue in under age 30 but not for those above 60? Any MD can please explain?
1459225506000216066	https://twitter.com/twitter/statuses/1459225506000216066	Fri Nov 12 18:24:06 +0000 2021	@CBCAlerts At the same time other countries are banning Moderna vaccine for anyone under 30. Does Canada only take advice from big pharma?
1459220832941748235	https://twitter.com/twitter/statuses/1459220832941748235	Fri Nov 12 18:05:32 +0000 2021	if I get booster  have had  all 3 vaccines.😯🤦🏻‍♀️🤪 #AstraZeneca #Pfizer #Moderna #ontariohealth #CovidVaccine
1459220701815083010	https://twitter.com/twitter/statuses/1459220701815083010	Fri Nov 12 18:05:00 +0000 2021	#AstraZeneca have broken their promise to provide the vaccine on a not-for-profit basis to low and middle income countries in perpetuity. There are 75 middle income countries, of which 20 are lower middle income, who we understand will now pay a for profit price for the vaccine.
1459215832618352647	https://twitter.com/twitter/statuses/1459215832618352647	Fri Nov 12 17:45:40 +0000 2021	@split_my Sincerely hope your son recovers fully from this 🙏  May I ask which vaccine he had - Moderna? Here in the UK we are currently only receiving the Pfizer version but are also seeing similar cases and experiencing the same worries.
1459212324372459524	https://twitter.com/twitter/statuses/1459212324372459524	Fri Nov 12 17:31:43 +0000 2021	@Redpainter1 Received my booster Wednesday along with my flu shot.\nI had a cornucopia of COVID vaccines;\nFirst - AstraZeneca\nSecond - Moderna\nBooster - Pfizer\n🙌
1459210086585229312	https://twitter.com/twitter/statuses/1459210086585229312	Fri Nov 12 17:22:50 +0000 2021	@citynewscalgary Mixing vaccines provides better immunity than several doses of the same vaccine. I had AstraZeneca + Pfizer, so approving Moderna's booster is great news.
1459206266778230785	https://twitter.com/twitter/statuses/1459206266778230785	Fri Nov 12 17:07:39 +0000 2021	@DrutangAtHome Sorry for your loss. I was admitted to the ER a couple weeks after my second dose of Moderna with a heart attack. What I realized was there is no government assistance with the vaccine injury bills or time needed off work. This vaccine ruined me. Still fighting though.
1459206149744603136	https://twitter.com/twitter/statuses/1459206149744603136	Fri Nov 12 17:07:11 +0000 2021	@MaryLTrump @SimmonsGmarlins I'm like neopolitan ice cream; my first vaccine was AstraZeneca, my second was Moderna, and my booster was Pfizer.
1459205595207110656	https://twitter.com/twitter/statuses/1459205595207110656	Fri Nov 12 17:04:59 +0000 2021	Germany joins Scandinavian countries and France in halting Moderna for people under 30 AND also halts for pregnant women. \n\nThis is why so many people have held off on getting the vaccine until more data and information have become available. Not so stupid after all…
1459203422490529799	https://twitter.com/twitter/statuses/1459203422490529799	Fri Nov 12 16:56:21 +0000 2021	As more countries continue to halt moderna vaccine for under 30 due to health concerns with it, @GovCanHealth moves forward to inject more like the data doesn’t even exist. Profits before patients.
1459195479733030917	https://twitter.com/twitter/statuses/1459195479733030917	Fri Nov 12 16:24:47 +0000 2021	"@JustLaElisa17 Found this quote:\n\n""If the Pfizer, moderna and AstraZeneca vaccines were sold on Amazon, how many people would buy after reading customer reviews."""
1459179590056873996	https://twitter.com/twitter/statuses/1459179590056873996	Fri Nov 12 15:21:39 +0000 2021	✔Individuals who received a complete series of a viral vector vaccine (two doses of the AstraZeneca vaccine or one dose of the Janssen vaccine)\n✔First Nation, Inuit and Métis adults and their non-Indigenous household members 3/5
1459175611335905280	https://twitter.com/twitter/statuses/1459175611335905280	Fri Nov 12 15:05:50 +0000 2021	@IainB13rown @HamiltonFHT @STJOESHAMILTON @HamHealthSci @HPS_Paramedics @HamiltonFamMed @McMasterFamMed @ONThealth Hi Iain, to date, 2 doses of the COVID-19 vaccines (Pfizer &amp; Moderna) have been shown to maintain high vaccine effectiveness with no evidence of waning against serious illness, hospitalization, and death from COVID-19 in most populations. (1/4)
1459169136253317120	https://twitter.com/twitter/statuses/1459169136253317120	Fri Nov 12 14:40:06 +0000 2021	Moderna is now testing Covid-19 vaccines on infants despite zero risk. Where is this going to stop?
1459157607902593027	https://twitter.com/twitter/statuses/1459157607902593027	Fri Nov 12 13:54:18 +0000 2021	@Craig_A_Spencer Pfizer and Moderna need to get over themselves, and tech transfer the vaccines. We need production facilities on the ground in Africa, in southeast Asia, in Central and South America.
1459098605663494159	https://twitter.com/twitter/statuses/1459098605663494159	Fri Nov 12 09:59:50 +0000 2021	Finland, Sweden, Norway, and Iceland have all banned the Moderna vaccine. \n\nnot a word from the FDA
1459310024723996677	https://twitter.com/twitter/statuses/1459310024723996677	Fri Nov 12 23:59:57 +0000 2021	Netherlands has record infections. They use covid passports. \n\nGermany has record infections. They use covid passports. \n\nAustria has record infections. They use covid passports. \n\nWhat's going on?
1459309936513630214	https://twitter.com/twitter/statuses/1459309936513630214	Fri Nov 12 23:59:36 +0000 2021	@Meagain10411919 @Jasper1166 @Walter23511244 @RubinReport My friends child died of meningitis when she denied the vaccine.   Biggest regret of her life killing her own child by listening to anti-vax lies
1459309867827662848	https://twitter.com/twitter/statuses/1459309867827662848	Fri Nov 12 23:59:19 +0000 2021	Mass asymptomatic testing was/is unscientific, unethical, harmful. Politicians/bureaucrats now pushing for removal of asymptomatic PCR testing ONLY for Canadian travellers deemed “vaccinated” are pushing unscientific discrimination: vaccine doesn’t prevent infection/transmission.
1459309844142325761	https://twitter.com/twitter/statuses/1459309844142325761	Fri Nov 12 23:59:14 +0000 2021	@HNTurtledove We had antivaxxers interrupting Remembrance Day respects by veterans at cenotaphs (there was no public ceremony because of covid). They just keep lowering the bar.
1459309836290564097	https://twitter.com/twitter/statuses/1459309836290564097	Fri Nov 12 23:59:12 +0000 2021	My gf in #Victoria on insta just said her kids are sick and so is she but it’s just a cold was told by the covid test booking people she did not need a test 🤦‍♀️🤦‍♀️ 21 months in this is #BC @VanIslandHealth
1459309755285925889	https://twitter.com/twitter/statuses/1459309755285925889	Fri Nov 12 23:58:52 +0000 2021	@BoredAlive1 @SexyEmmm @GuyThompson_Esq @cbcnewsbc Also the flu vaccine swaps virus’s every year. A vaccine can still be vaccine if u only swap the virus. This isnt new.
1459309677536239621	https://twitter.com/twitter/statuses/1459309677536239621	Fri Nov 12 23:58:34 +0000 2021	@brechnermaga @Walter23511244 @RubinReport Bull. We got plenty of vaccine boosters as kids. Also we are getting COVID boosters because the virus is mutating because it’s being spread by the unvaccinated.
1459309516185649161	https://twitter.com/twitter/statuses/1459309516185649161	Fri Nov 12 23:57:55 +0000 2021	Current Covid-19 vaccines:\n- reduce morbidity:😊\n- reduce mortality: 🙂\n- reduce transmission:🤨\n- may require 3/4 doses: 🧐\n- are produced by ethical companies: ☹️
1459309426733576194	https://twitter.com/twitter/statuses/1459309426733576194	Fri Nov 12 23:57:34 +0000 2021	Fact check was all about his tweets - didn't he say this in one of his post-covid TV bits?
1459309412619849729	https://twitter.com/twitter/statuses/1459309412619849729	Fri Nov 12 23:57:31 +0000 2021	% of Americans likely to never get a vaccine via @MonmouthPoll\n\nMarch 24%\nJune 21%\nJuly 17%\nSept 15%\nNow 13%\n\nAnti-vaxxers who have gotten vaxxed are now using Borax (cleaning agent) and baking soda to undo the vaccine\n\nSpoiler: You can’t undo it. Also you’re an idiot for trying
1459309385755373568	https://twitter.com/twitter/statuses/1459309385755373568	Fri Nov 12 23:57:24 +0000 2021	@Laurie_Garrett Well white supremacists not getting the vaccine, not sure I should be upset about it.
1459309306982113284	https://twitter.com/twitter/statuses/1459309306982113284	Fri Nov 12 23:57:06 +0000 2021	My family and most friends think I'm crazy for refusing to comply with vaccine passports. I think they are crazy for feeling like vaccine passports are no big deal. \n\nI'm having trouble relating to people that don't care. How do they not see how dangerous this path is?
1459309285771407363	https://twitter.com/twitter/statuses/1459309285771407363	Fri Nov 12 23:57:01 +0000 2021	The Netherlands (72.1% fully vaccinated) is going back into a full lockdown tomorrow night, for both vaccinated and the unvaccinated.\n\nI doubt that’s going to do much to instill confidence in the vaccination campaign!
1459309262413443075	https://twitter.com/twitter/statuses/1459309262413443075	Fri Nov 12 23:56:55 +0000 2021	The Aaron Rodgers debacle, coupled with recent comments from celebrities ill-informed about vaccination, is a reminder to quit treating athletes, actors and influencers as role models. Pick a scientist, a doctor, or a teacher instead. You’ll wind up smarter.
1459309173741604872	https://twitter.com/twitter/statuses/1459309173741604872	Fri Nov 12 23:56:34 +0000 2021	@upshur_ross I also do not see the evidence that supports all of us receiving 3rd doses in lieu of equity of access. 🇨🇦happily took #vaccine when 🇮🇳 entered it's wave, and complained bitterly abt 🇺🇸🇬🇧 not sharing. \nBut, is there evidence of vax'd HCWs cauung outbreaks w asymptomatic transm'n?
1459309142443708422	https://twitter.com/twitter/statuses/1459309142443708422	Fri Nov 12 23:56:26 +0000 2021	Dutch government now openly admitting the vaccinated are infecting the unvaccinated. \n\nSo while Ontario tries to justify vaccine passports by saying it protects the vaxxed from the unvaxxed, the Dutch government now explicitly says it is to protect the unvaxxed from the vaxxed.
1459309095836549125	https://twitter.com/twitter/statuses/1459309095836549125	Fri Nov 12 23:56:15 +0000 2021	· Address AHS staffing rules that drive up costs and limit our ability to increase capacity.\n\n· Convene regional, interfaith, and other group panels to lower tensions and work with groups with low vaccine uptake; to better understand their concerns and engage with them.
1459309083928977408	https://twitter.com/twitter/statuses/1459309083928977408	Fri Nov 12 23:56:12 +0000 2021	"@JCCFCanada Trudeau you've been mean to ""unvaxxed"" people treating them like 2nd class citizens and pretty much inciting abuse to everyone who does not trust this new vaccine when they have legitimate reasons to be concerned about it, we're not a cult."
1459309043915235328	https://twitter.com/twitter/statuses/1459309043915235328	Fri Nov 12 23:56:03 +0000 2021	I now know why vaccinations, COVID geocide and climate control are connected?   Each of us exhales about 2.3 pounds of CO2 per day, times about 7.9 billion people, and collectively we exhale about 18.4 billion pounds of CO2 per day.  That's why they are trying to kill us.
1459309037506469891	https://twitter.com/twitter/statuses/1459309037506469891	Fri Nov 12 23:56:01 +0000 2021	@laramica21 @Walter23511244 @RubinReport Yes actually I just had to redo measles because my immunity waned and my tetanus every 10 years.  Also got Shingles vaccine because I had chicken pox.  Shingles is brutal don’t want that either!
1459309028765487106	https://twitter.com/twitter/statuses/1459309028765487106	Fri Nov 12 23:55:59 +0000 2021	@leigh409 Do you believe that literally any other person who was the president would have not done what Trump did in regards to “creating the vaccine” on at least the same timeline? Are you crazy enough to think otherwise? He basically went “yeah ok here’s money”
1459309015398338564	https://twitter.com/twitter/statuses/1459309015398338564	Fri Nov 12 23:55:56 +0000 2021	@JCCFCanada I agree. A dangerous, experimental injection, created and pushed by criminal mobsters, shouldn't be called a 'vaccine', and the radical extremists pushing it, and coercing the public should be indicted for crimes against humanity.
1459308979788689416	https://twitter.com/twitter/statuses/1459308979788689416	Fri Nov 12 23:55:48 +0000 2021	@BLovesSoAL Thank you Betsy for your support and yes, the vaccine is supposed to protect you. Wishing you good health and a pleasant weekend.
1459308930300092417	https://twitter.com/twitter/statuses/1459308930300092417	Fri Nov 12 23:55:36 +0000 2021	My daughter works in a pharmacy that gives vaccines. A lady offered the pharmacist $2000 to waste the vaccine and just give her the receipt. She needs it to travel. Of course the pharmacist said no. What is wrong with people??
1459308871940554754	https://twitter.com/twitter/statuses/1459308871940554754	Fri Nov 12 23:55:22 +0000 2021	@DustyRoseYYC @blueicats Anti-vaxxer is offensive. People are fully vaccinated. Just not jabbed.\nYou notice the flu shot is not called a vaccine, it is a shot that may lessen your symptoms. The jab should be called COVID-19 shot to be accurate. It is not a vaccine.
1459308791531327492	https://twitter.com/twitter/statuses/1459308791531327492	Fri Nov 12 23:55:03 +0000 2021	@bamesbmw @SamIAm2021MD You don't need a Covid19 vaccine, you need a Covid21 vaccine. It's like the flu, your gonna need a different booster every year.
1459308782752714754	https://twitter.com/twitter/statuses/1459308782752714754	Fri Nov 12 23:55:01 +0000 2021	"Geologist here: Borax is not going ""detox"" you post-Covid vaccine. It is an evaporite mineral that will certainly help clean your laundry, wash your hands, and possibly whiten your teeth. \n\nLISTEN TO SCIENTISTS, PEOPLE."
1459308769452732419	https://twitter.com/twitter/statuses/1459308769452732419	Fri Nov 12 23:54:57 +0000 2021	@evaholland Noticing that they no longer say they will update the vaccination tracker weekly....
1459308767972143104	https://twitter.com/twitter/statuses/1459308767972143104	Fri Nov 12 23:54:57 +0000 2021	BREAKING: Oklahoma National Guard’s new top general ends COVID vaccine mandate 🇺🇸
1459308764612505608	https://twitter.com/twitter/statuses/1459308764612505608	Fri Nov 12 23:54:56 +0000 2021	Five more SK covid deaths today. Three aged 40-59, two aged 60-79. They lived in FNW, CE, Regina (2) and SE. Since SK removed all public health restrictions 4 months ago we have lost this many people to preventable covid:\n12x 20-39\n31x 40-59\n112x 60-79\n127x 80+\nSo tragic.
1459308735629869058	https://twitter.com/twitter/statuses/1459308735629869058	Fri Nov 12 23:54:49 +0000 2021	Austria🇦🇹: Planning lockdown for the unvaccinated\n\nItaly🇮🇹: People banned from going to work without covid passport\n\nCanada🇨🇦: Banning people from flying based on medical status\n\nLatvia🇱🇻: Democratically elected politicians banned from voting in parliament based on medical status
1459308601080639492	https://twitter.com/twitter/statuses/1459308601080639492	Fri Nov 12 23:54:17 +0000 2021	Latvia are banning MPs from voting in parliament if they haven't been vaccinated or recovered from covid.\n\nSo democratically elected politicians will be BANNED from voting in parliament based on their medical status. \n\nThat escalated quickly.
1459308470721601538	https://twitter.com/twitter/statuses/1459308470721601538	Fri Nov 12 23:53:46 +0000 2021	· Directly import the single-shot Johnson &amp; Johnson vaccine, which is more acceptable to some Albertans than the current vaccines being offered. \n\n· Recruit retired emergency medical technicians and paramedics to increase capacity, especially in rural and remote areas.
1459308459854221313	https://twitter.com/twitter/statuses/1459308459854221313	Fri Nov 12 23:53:44 +0000 2021	history will look back on the anti-Covid vaccine activists of this era and regard them as complete idiots
1459308443479654400	https://twitter.com/twitter/statuses/1459308443479654400	Fri Nov 12 23:53:40 +0000 2021	Deer are getting the Covid \nHow much more of this are we going to take \nHow stupid do the Elite think we are? It's not about health It's about expanding &amp; profiting from the vaccine market Depopulate in the process Re-engineer our world for their benefit &amp; we play along ... WHY?
1459308393378848769	https://twitter.com/twitter/statuses/1459308393378848769	Fri Nov 12 23:53:28 +0000 2021	@JillyIdris @adamsonbarbecue @randyhillier I guess if you agree with the health code then everything is hunky dory for you. We’ve reached over % vaccination rate and it’s confirmed it doesn’t stop spread anyways. This is ridiculous at this point. Just don’t frequent restaurants who aren’t discriminating 🤷‍♀️
1459308268363272193	https://twitter.com/twitter/statuses/1459308268363272193	Fri Nov 12 23:52:58 +0000 2021	@greasygoals20 @JimTrotter7 @YourAlberta It has nothing to do with trust.\nEverything with a choice.  You can go without vaccination, but then follow through with your choice. Being in a restaurant, or taking a flight is a privilege, not a right.  Personally, wouldn’t want you  near my elderly mother and that is my right
1459308236973260800	https://twitter.com/twitter/statuses/1459308236973260800	Fri Nov 12 23:52:50 +0000 2021	In my class on biomedical ethics today we discussed the mandatory vaccination of care home workers. The vast majority of the class ruled it unethical on all three core values: autonomy, nonmaleficence and beneficience.\n\nI can’t stop thinking how nervous I felt putting this
1459308217264062466	https://twitter.com/twitter/statuses/1459308217264062466	Fri Nov 12 23:52:46 +0000 2021	@edmontonjournal There are things that the electorate are willing to overlook but vaccination is not one of them. The road back to some Normal is through Vaccination.
1459308134942584840	https://twitter.com/twitter/statuses/1459308134942584840	Fri Nov 12 23:52:26 +0000 2021	Listen. I am vaccinated. I believe in vaccination. Usually to stop me getting a disease. But these vaccines are not stopping transmission so to segregate societies into ‘clean’ and ‘unclean’ like Australia and Austria is the most disgusting &amp; cruel thing I’ve witnessed in my life
1459308096799457283	https://twitter.com/twitter/statuses/1459308096799457283	Fri Nov 12 23:52:17 +0000 2021	"@edmontonjournal By stating that he ""opposes mandatory COVID-19 vaccinations"", something that NOBODY has ever advocated for, Brian Jean is virtue-signalling to the extreme anti-vax community that he is one of them....."
1459308010279510019	https://twitter.com/twitter/statuses/1459308010279510019	Fri Nov 12 23:51:56 +0000 2021	@ChuckWurster I’m almost 1 week past my 3rd Pfizer dose, healthcare LTC frontliner here in ON 🙋‍♀️\n#vaccinesupporter #COVID19Ontario
1459307688899215365	https://twitter.com/twitter/statuses/1459307688899215365	Fri Nov 12 23:50:40 +0000 2021	@Climatologist49 Open defiance of vaccine passports here. Liquor licence yanked, restaurant still serving meals in defiance. Yellow wristbands for the ungeimpft may soon be here.
1459307686940618755	https://twitter.com/twitter/statuses/1459307686940618755	Fri Nov 12 23:50:39 +0000 2021	@TheChinMeister_ If covid has taught you anything, it should be to wear a mask.
1459307655294439424	https://twitter.com/twitter/statuses/1459307655294439424	Fri Nov 12 23:50:32 +0000 2021	I'm starting to think the vaccines poor effectiveness is part of the plan\n\nBy admitting the vaccine has low efficacy, they can shape the narrative about needing a booster every few months. Of course, it'll be applied to your vax pass.\n\nIf the herd accepts this, we're in trouble.
1459307538130763778	https://twitter.com/twitter/statuses/1459307538130763778	Fri Nov 12 23:50:04 +0000 2021	@TSM_Merc NA gets shafted by covid for 2 events in a row and the sky starts falling
1459307458879389697	https://twitter.com/twitter/statuses/1459307458879389697	Fri Nov 12 23:49:45 +0000 2021	"@yllakat I saw a TikTok where a country is ""treating those who are unvaxxed"" like American. As in their Healthcare is not free for being in the hospital with covid if you are not vaxxed. \n\nThat should be the same for here too. Why should people who are doing the heavy lifting have to wait"
1459307114002718723	https://twitter.com/twitter/statuses/1459307114002718723	Fri Nov 12 23:48:23 +0000 2021	@infinite99 @Glow60Glow Hmmmm… I think since before covid!
1459307107044388867	https://twitter.com/twitter/statuses/1459307107044388867	Fri Nov 12 23:48:21 +0000 2021	@BoredAlive1 @SexyEmmm @GuyThompson_Esq @cbcnewsbc 20 years to develop, not test. The one they tested was not the one from 1935. Mrna vaccines also took 20 years to develop, the covid one is not the one used in 2017. Both polio and covid vaccines were tested for a year and then approved.
1459307103097548803	https://twitter.com/twitter/statuses/1459307103097548803	Fri Nov 12 23:48:20 +0000 2021	The covid injections were voluntary until it became clear they really don’t work very well. At that point they became mandatory.
1459307030628352006	https://twitter.com/twitter/statuses/1459307030628352006	Fri Nov 12 23:48:03 +0000 2021	"1/5  Mike died. \n\nHis message: ""Many nurses and non-nursing staff begged me &amp; my wife to get the truth out to the public about the Covid-19 vacsbecause the truth of deaths from the vaccine was being hidden within the medical profession. I promised I would get the message out."
1459307010072231936	https://twitter.com/twitter/statuses/1459307010072231936	Fri Nov 12 23:47:58 +0000 2021	@AeonicEnergy @TFifi9 @PremierScottMoe Compared with fully vaccinated people, unvaccinated individuals are also seven times more likely to catch COVID-19, 25 times more likely to be hospitalized, and 60 times more likely to be in the ICU due to the disease. #covid19sk
1459306986860736512	https://twitter.com/twitter/statuses/1459306986860736512	Fri Nov 12 23:47:52 +0000 2021	Mandating a fast tracked vaccine with death listed as a side effect is attempted murder IMO.
1459306939138154497	https://twitter.com/twitter/statuses/1459306939138154497	Fri Nov 12 23:47:41 +0000 2021	Last night I heard the weirdest, most surreal Covid story of the pandemic.  A friend told me of her anti-vax family members - who remain staunchly anti-vax despite losing several friends to the virus. How could a vaccine be worse?  Unbelievable.
1459306931793764354	https://twitter.com/twitter/statuses/1459306931793764354	Fri Nov 12 23:47:39 +0000 2021	I know a lot of people who regret getting the vaccine. Don’t know anyone who regrets not getting it.
1459306878094163976	https://twitter.com/twitter/statuses/1459306878094163976	Fri Nov 12 23:47:27 +0000 2021	Health Canada says it expects to make a decision in the next 1-2 weeks on whether to approve Pfizer's COVID-19 vaccine for children aged 5-11.
